{
  "$schema": "https://json-schema.org/draft/2020-12/schema",
  "$id": "https://schemas.intelliger.ai/oati/conformance-suite.schema.json",
  "title": "OATI Conformance Suite",
  "type": "object",
  "additionalProperties": false,
  "required": ["suite_version", "standard_version", "cases"],
  "properties": {
    "suite_version": { "type": "string", "pattern": "^[0-9]+\\.[0-9]+\\.[0-9]+$" },
    "standard_version": { "type": "string" },
    "extends": { "type": "string", "pattern": "^suite-v[0-9]+\\.[0-9]+\\.json$" },
    "cases": {
      "type": "array",
      "minItems": 1,
      "items": {
        "type": "object",
        "additionalProperties": false,
        "required": ["id", "category", "operation", "input", "expected"],
        "properties": {
          "id": { "type": "string", "pattern": "^[a-z0-9][a-z0-9._-]+$" },
          "category": { "enum": ["core", "canonicalization", "signature", "delegation", "revocation-expiry", "replay-audience", "privacy", "commerce", "rwa", "discovery"] },
          "operation": { "enum": ["schema", "canonicalize", "verify", "verify-replay", "evaluate-suite", "public-project", "discover"] },
          "schema": { "type": "string" },
          "input": { "type": "string" },
          "auxiliary": { "type": "string" },
          "options": { "type": "object" },
          "expected": {
            "type": "object",
            "additionalProperties": false,
            "required": ["outcome", "codes"],
            "properties": {
              "outcome": { "enum": ["pass", "fail"] },
              "codes": { "type": "array", "items": { "type": "string" }, "uniqueItems": true }
            }
          }
        }
      }
    }
  }
}
