{
  "suite_version": "0.3.0",
  "standard_version": "1.0",
  "extends": "suite-v0.2.json",
  "cases": [
    { "id": "signature.es256.valid", "category": "signature", "operation": "verify", "input": "crypto/es256-signed-envelope.json", "auxiliary": "crypto/es256-trust-bundle.json", "options": { "audience": "https://merchant.example", "now": "2026-07-27T12:02:00Z" }, "expected": { "outcome": "pass", "codes": [] } },
    { "id": "signature.es256.tampered", "category": "signature", "operation": "verify", "input": "crypto/es256-tampered-envelope.json", "auxiliary": "crypto/es256-trust-bundle.json", "options": { "audience": "https://merchant.example", "now": "2026-07-27T12:02:00Z" }, "expected": { "outcome": "fail", "codes": ["SIGNATURE_INVALID"] } },
    { "id": "issuer-chain.multilevel.valid", "category": "signature", "operation": "verify", "input": "crypto/signed-envelope.json", "auxiliary": "crypto/issuer-chain-trust-bundle.json", "options": { "audience": "https://merchant.example", "now": "2026-07-27T12:02:00Z" }, "expected": { "outcome": "pass", "codes": [] } },
    { "id": "issuer-chain.missing-parent", "category": "signature", "operation": "verify", "input": "crypto/signed-envelope.json", "auxiliary": "crypto/issuer-chain-broken-bundle.json", "options": { "audience": "https://merchant.example", "now": "2026-07-27T12:02:00Z" }, "expected": { "outcome": "fail", "codes": ["ISSUER_NOT_TRUSTED"] } },
    { "id": "issuer-chain.cycle", "category": "signature", "operation": "verify", "input": "crypto/signed-envelope.json", "auxiliary": "crypto/issuer-chain-cycle-bundle.json", "options": { "audience": "https://merchant.example", "now": "2026-07-27T12:02:00Z" }, "expected": { "outcome": "fail", "codes": ["ISSUER_NOT_TRUSTED"] } },
    { "id": "issuer-chain.suspended", "category": "revocation-expiry", "operation": "verify", "input": "crypto/signed-envelope.json", "auxiliary": "crypto/issuer-suspended-bundle.json", "options": { "audience": "https://merchant.example", "now": "2026-07-27T12:02:00Z" }, "expected": { "outcome": "fail", "codes": ["ISSUER_REVOKED"] } },
    { "id": "rotation.retired-overlap.valid", "category": "revocation-expiry", "operation": "verify", "input": "crypto/signed-envelope.json", "auxiliary": "crypto/rotation-retired-bundle.json", "options": { "audience": "https://merchant.example", "now": "2026-07-27T12:02:00Z" }, "expected": { "outcome": "pass", "codes": [] } },
    { "id": "rotation.retired-without-expiry", "category": "revocation-expiry", "operation": "verify", "input": "crypto/signed-envelope.json", "auxiliary": "crypto/rotation-retired-without-expiry-bundle.json", "options": { "audience": "https://merchant.example", "now": "2026-07-27T12:02:00Z" }, "expected": { "outcome": "fail", "codes": ["KEY_INVALID"] } },
    { "id": "rotation.proof-after-key-expiry", "category": "revocation-expiry", "operation": "verify", "input": "crypto/signed-envelope.json", "auxiliary": "crypto/rotation-proof-after-key-expiry-bundle.json", "options": { "audience": "https://merchant.example", "now": "2026-07-27T12:02:00Z" }, "expected": { "outcome": "fail", "codes": ["KEY_INVALID"] } },
    { "id": "revocation.key-target", "category": "revocation-expiry", "operation": "verify", "input": "crypto/signed-envelope.json", "auxiliary": "crypto/revocation-key-target-bundle.json", "options": { "audience": "https://merchant.example", "now": "2026-07-27T12:02:00Z" }, "expected": { "outcome": "fail", "codes": ["KEY_REVOKED"] } },
    { "id": "revocation.issuer-target", "category": "revocation-expiry", "operation": "verify", "input": "crypto/signed-envelope.json", "auxiliary": "crypto/revocation-issuer-target-bundle.json", "options": { "audience": "https://merchant.example", "now": "2026-07-27T12:02:00Z" }, "expected": { "outcome": "fail", "codes": ["ISSUER_REVOKED"] } },
    { "id": "revocation.document-suspended", "category": "revocation-expiry", "operation": "verify", "input": "crypto/signed-envelope.json", "auxiliary": "crypto/revocation-document-suspended-bundle.json", "options": { "audience": "https://merchant.example", "now": "2026-07-27T12:02:00Z" }, "expected": { "outcome": "fail", "codes": ["DOCUMENT_REVOKED"] } },
    { "id": "revocation.future-effective", "category": "revocation-expiry", "operation": "verify", "input": "crypto/signed-envelope.json", "auxiliary": "crypto/revocation-future-effective-bundle.json", "options": { "audience": "https://merchant.example", "now": "2026-07-27T12:02:00Z" }, "expected": { "outcome": "pass", "codes": [] } },
    { "id": "revocation.ambiguous", "category": "revocation-expiry", "operation": "verify", "input": "crypto/signed-envelope.json", "auxiliary": "crypto/revocation-ambiguous-bundle.json", "options": { "audience": "https://merchant.example", "now": "2026-07-27T12:02:00Z" }, "expected": { "outcome": "fail", "codes": ["REVOCATION_UNAVAILABLE"] } },
    { "id": "revocation.unavailable", "category": "revocation-expiry", "operation": "verify", "input": "crypto/signed-envelope.json", "auxiliary": "crypto/revocation-unavailable-bundle.json", "options": { "audience": "https://merchant.example", "now": "2026-07-27T12:02:00Z" }, "expected": { "outcome": "fail", "codes": ["REVOCATION_UNAVAILABLE"] } }
  ]
}
